{
  "schemaVersion": 1,
  "template": "cpp17-function",
  "slug": "merge-sorted-arrays",
  "title": "Merge Sorted Arrays",
  "difficulty": "Easy",
  "tags": ["array", "two-pointers", "sorting"],
  "statement": "Given two integer arrays sorted in non-decreasing order, return one new array containing every value from both inputs in non-decreasing order.",
  "constraints": [
    "0 <= first.length, second.length <= 100",
    "1 <= first.length + second.length",
    "-10000 <= each value <= 10000",
    "Both input arrays are sorted in non-decreasing order"
  ],
  "signature": {
    "className": "Solution",
    "methodName": "mergeSorted",
    "returnType": "Int32Array",
    "parameters": [
      { "name": "first", "type": "Int32Array" },
      { "name": "second", "type": "Int32Array" }
    ]
  },
  "samples": [
    {
      "arguments": { "first": [1, 3, 5], "second": [2, 4, 6] },
      "expected": [1, 2, 3, 4, 5, 6]
    },
    {
      "arguments": { "first": [], "second": [-2, 0, 7] },
      "expected": [-2, 0, 7]
    }
  ],
  "generatorParameters": {}
}
