{
  "schemaVersion": 1,
  "template": "int-identity",
  "slug": "ui-explicit-skip",
  "title": "UI Demo: Explicit Skip",
  "difficulty": "Easy",
  "tags": ["demo", "skip"],
  "statement": "This valid item is deliberately marked with the skip import action.",
  "constraints": ["1 <= value <= 100"],
  "signature": {
    "className": "Solution",
    "methodName": "identity",
    "returnType": "Int32",
    "parameters": [{ "name": "value", "type": "Int32" }]
  },
  "samples": [
    { "arguments": { "value": 17 }, "expected": 17 }
  ],
  "generatorParameters": {}
}
