{
  "schemaVersion": 1,
  "template": "cpp17-function",
  "slug": "single-number",
  "title": "Single Number",
  "difficulty": "Easy",
  "tags": ["array", "bit-manipulation"],
  "statement": "Given a non-empty integer array nums, every value appears exactly twice except for one value that appears once. Return the value that appears once.",
  "constraints": [
    "1 <= nums.length <= 99",
    "nums.length is odd",
    "-10000 <= nums[i] <= 10000",
    "Exactly one value appears once and every other value appears twice"
  ],
  "signature": {
    "className": "Solution",
    "methodName": "singleNumber",
    "returnType": "Int32",
    "parameters": [{ "name": "nums", "type": "Int32Array" }]
  },
  "samples": [
    { "arguments": { "nums": [2, 2, 1] }, "expected": 1 },
    { "arguments": { "nums": [4, 1, 2, 1, 2] }, "expected": 4 }
  ],
  "generatorParameters": {}
}
