{
  "schemaVersion": 1,
  "template": "int-identity",
  "slug": "ui-template-only",
  "title": "UI Demo: Template Only (Revision 2)",
  "difficulty": "Easy",
  "tags": ["demo", "template", "revision"],
  "statement": "Return the supplied integer unchanged. This text creates a distinct content hash for revision 2.",
  "constraints": ["1 <= value <= 100"],
  "signature": {
    "className": "Solution",
    "methodName": "identity",
    "returnType": "Int32",
    "parameters": [{ "name": "value", "type": "Int32" }]
  },
  "samples": [
    { "arguments": { "value": 42 }, "expected": 42, "explanation": "Revision 2 uses a new public sample." }
  ],
  "generatorParameters": {}
}
