{
  "schemaVersion": 1,
  "template": "cpp17-function",
  "slug": "maximum-subarray",
  "title": "Maximum Subarray",
  "difficulty": "Medium",
  "tags": ["array", "dynamic-programming", "divide-and-conquer"],
  "statement": "Given a non-empty integer array nums, return the largest possible sum of a contiguous subarray. A subarray must contain at least one element.",
  "constraints": [
    "1 <= nums.length <= 100",
    "-10000 <= nums[i] <= 10000"
  ],
  "signature": {
    "className": "Solution",
    "methodName": "maxSubArray",
    "returnType": "Int32",
    "parameters": [{ "name": "nums", "type": "Int32Array" }]
  },
  "samples": [
    {
      "arguments": { "nums": [-2, 1, -3, 4, -1, 2, 1, -5, 4] },
      "expected": 6,
      "explanation": "The subarray [4,-1,2,1] has sum 6."
    },
    {
      "arguments": { "nums": [-8, -3, -6, -2, -5, -4] },
      "expected": -2,
      "explanation": "For an all-negative array, the best subarray is the largest single element."
    }
  ],
  "generatorParameters": {}
}
