{
  "schemaVersion": 1,
  "template": "int-identity",
  "slug": "ui-validator-override",
  "title": "UI Demo: Validator Override",
  "difficulty": "Easy",
  "tags": ["demo", "validator"],
  "statement": "Return the supplied integer unchanged. This problem overrides validator.cs.",
  "constraints": ["1 <= value <= 100"],
  "signature": {
    "className": "Solution",
    "methodName": "identity",
    "returnType": "Int32",
    "parameters": [{ "name": "value", "type": "Int32" }]
  },
  "samples": [
    { "arguments": { "value": 13 }, "expected": 13 }
  ],
  "generatorParameters": {}
}
