{
  "schemaVersion": 1,
  "template": "cpp17-function",
  "slug": "climbing-stairs",
  "title": "Climbing Stairs",
  "difficulty": "Easy",
  "tags": ["dynamic-programming", "math"],
  "statement": "A staircase has n steps. On each move you may climb either 1 or 2 steps. Return the number of distinct sequences of moves that reach exactly the top.",
  "constraints": ["1 <= n <= 45"],
  "signature": {
    "className": "Solution",
    "methodName": "climbStairs",
    "returnType": "Int32",
    "parameters": [{ "name": "n", "type": "Int32" }]
  },
  "samples": [
    { "arguments": { "n": 2 }, "expected": 2 },
    { "arguments": { "n": 5 }, "expected": 8 }
  ],
  "generatorParameters": {}
}
